{"check_id":"01bfb8de-d28c-4ccb-99ae-92d906305c4f","ingredients":[{"name":"цитрат магнію","quantity":500,"unit":"мг","type":"active"},{"name":"цинк цитрат","quantity":30,"unit":"мг","type":"active"},{"name":"екстракт півонії (10:1)","quantity":10,"unit":"мг","type":"active"},{"name":"вітамін В7 (біотин)","quantity":50,"unit":"мкг","type":"active"},{"name":"вітамін В6","quantity":1,"unit":"мг","type":"active"},{"name":"вітамін В12","quantity":1.5,"unit":"мкг","type":"active"},{"name":"МКЦ","quantity":null,"unit":null,"type":"excipient"},{"name":"крохмаль","quantity":null,"unit":null,"type":"excipient"},{"name":"кремнію діоксид","quantity":null,"unit":null,"type":"excipient"},{"name":"стеарат кальцію","quantity":null,"unit":null,"type":"excipient"}],"product_info":{"name":"МАГНІЙ 500+Б6+В12","form":"таблетки","quantity":120,"batch_number":"17.09.2025"},"allergens":[],"allergen_statement":null,"mandatory_phrases":{"has_dietary_supplement_label":true,"has_not_medicine":true,"has_not_exceed_dose":true,"has_not_replace_diet":true,"has_keep_away_children":true},"full_text":"# ПОВНИЙ ТЕКСТ З ЕТИКЕТКИ:\n\nТМ\n\nДІЄТИЧНА ДОБАВКА\n\nМАГНІЙ 500+Б6+В12\n\nMg 500+B6+B12\n\n120 ТАБЛЕТОК\n\nСклад: цитрат магнію – 500 мг(mg), цинк цитрат – 30 мг(mg), екстокт півонії (10:1) – 10 мг(mg), вітамін В7 (біотин) – 50 мкг(μg), вітамін В6 – 1 мг(mg), вітамін В12 – 1,5 мкг(μg).\n\nДопоміжні речовини: МКЦ, крохмаль, кремнію діоксид, стеарат кальцію. Без ГМО.\n\nМаса вмісту 1 таблетки: 770 мг(mg) ±7,5%\n\nДобова доза, рекомендована для щоденного споживання: дорослим по 1-2 таблетки на день під час їжі.\n\nУмови зберігання: зберігати в сухому, захищеному від світла місці за температури від +5 °С до + 25 °С і відносній вологості повітря не більше 75% в недоступному для дітей місці.\n\nТермін придатності: 2 роки з дати виготовлення. Номер партії співпадає з датою виготовлення.\n\nВжити до: 17.09.2027\nПартія №: 17.09.2025\n\nISO 9001\n\nPET\n\nЗастереження до споживання: ІНДИВІДУАЛЬНА непереносимість компонентів продукту, вагітність, годування грудью. Перед вживанням проконсультуйтесь зі своїм лікарем. Дієтичні добавки не слід використовувати як заміну повноцінного раціону харчування. Не перевищувати рекомендовану дозу для щоденного споживання. Цей продукт не призначений для діагностики, лікування або запобігання будь-яких захворювань.\n\nНе є лікарським засобом.\n\nЗамовник (відповідальний за інформацію для споживачів): ТОВ «Українські вітаміни», Україна, Дніпропетровська обл., м. Дніпро, вул. Сонячно Набережна, буд. 2.\nТел.: +38(097)106-32-75\nABU.COM.UA\nТУ У 10.8-41815746-002:2021\nВиробник: ТОВ «Біо Лайт» Україна, Запорізька обл., м. Запоріжжя, вул. Перемоги, буд. 135-А Тел. +38(096)498-9128","operator":{"name":"ТОВ «Українські вітаміни»","edrpou":null,"address":"Україна, Дніпропетровська обл., м. Дніпро, вул. Сонячно Набережна, буд. 2","phone":"+38(097)106-32-75"},"warnings":["індивідуальна непереносимість компонентів продукту","вагітність","годування груддю"],"daily_dose":"дорослим по 1-2 таблетки на день під час їжі","storage":"зберігати в сухому, захищеному від світла місці за температури від +5 °С до + 25 °С і відносній вологості повітря не більше 75% в недоступному для дітей місці","manufacturer":{"name":"ТОВ «Біо Лайт»","address":"Україна, Запорізька обл., м. Запоріжжя, вул. Перемоги, буд. 135-А","phone":"+38(096)498-9128"},"shelf_life":"2 роки","tech_specs":"ТУ У 10.8-41815746-002:2021","extracted_at":"2025-11-18T19:39:04.333326"}